{
  "base_station": {
    "lineage": {
      "adapter": "cligen_rs_legacy_par_to_fixed_monthly",
      "adapter_version": 1,
      "source_format": "cligen_par_5_32_3",
      "source_sha256": "af2d895735444b947ecee0e7cdaf2dd249f526886f83250f8a0ed2631c96e5c2"
    },
    "parameters": {
      "identity": {
        "state_code": 21,
        "station_code": 4026,
        "station_name_raw": " INT FALLS WP AP MN                      ",
        "wind_et_flag": 0
      },
      "location": {
        "elevation": 1180,
        "latitude": 48.57,
        "longitude": -93.38,
        "record_years": 40
      },
      "precipitation": {
        "max_half_hour_intensity": [
          0.22,
          0.23,
          0.23,
          0.41,
          0.57,
          2.44,
          1.3,
          1.17,
          0.75,
          0.37,
          0.26,
          0.21
        ],
        "mean_daily": [
          0.07,
          0.07,
          0.11,
          0.18,
          0.24,
          0.29,
          0.31,
          0.27,
          0.24,
          0.18,
          0.13,
          0.07
        ],
        "probability_wet_given_dry": [
          0.28,
          0.22,
          0.24,
          0.23,
          0.3,
          0.4,
          0.35,
          0.31,
          0.31,
          0.29,
          0.25,
          0.29
        ],
        "probability_wet_given_wet": [
          0.47,
          0.47,
          0.42,
          0.46,
          0.52,
          0.52,
          0.45,
          0.44,
          0.51,
          0.5,
          0.51,
          0.46
        ],
        "skew": [
          3.74,
          2.62,
          2.91,
          2.39,
          3.11,
          3.46,
          3.45,
          2.85,
          2.53,
          3.39,
          2.79,
          3.28
        ],
        "standard_deviation_daily": [
          0.1,
          0.09,
          0.17,
          0.24,
          0.33,
          0.42,
          0.48,
          0.38,
          0.35,
          0.27,
          0.19,
          0.1
        ]
      },
      "solar_radiation": {
        "mean_daily": [
          103.0,
          177.0,
          276.0,
          398.0,
          468.0,
          493.0,
          511.0,
          433.0,
          310.0,
          184.0,
          101.0,
          77.0
        ],
        "standard_deviation_daily": [
          13.9,
          25.5,
          38.3,
          59.2,
          51.3,
          42.9,
          26.6,
          28.6,
          27.8,
          19.7,
          18.8,
          13.5
        ]
      },
      "storm": {
        "max_six_hour_precipitation": 4.27,
        "single_storm_type": 3,
        "time_to_peak_cdf": [
          0.517,
          0.701,
          0.776,
          0.845,
          0.858,
          0.865,
          0.946,
          0.956,
          0.966,
          0.976,
          0.99,
          1.0
        ]
      },
      "temperature": {
        "dew_point_mean": [
          -0.95,
          3.06,
          14.05,
          25.03,
          38.02,
          50.0,
          56.98,
          55.0,
          46.0,
          33.02,
          20.02,
          5.05
        ],
        "maximum_mean": [
          14.44,
          21.54,
          34.21,
          51.0,
          65.03,
          73.25,
          78.26,
          75.56,
          65.24,
          51.14,
          33.58,
          18.55
        ],
        "maximum_standard_deviation": [
          13.7,
          13.35,
          12.43,
          12.58,
          11.46,
          8.45,
          7.0,
          7.54,
          9.91,
          11.15,
          12.22,
          13.31
        ],
        "minimum_mean": [
          -6.64,
          -1.04,
          12.3,
          27.74,
          39.76,
          49.11,
          53.82,
          51.2,
          42.3,
          31.79,
          17.75,
          0.27
        ],
        "minimum_standard_deviation": [
          17.22,
          17.2,
          15.61,
          9.27,
          9.05,
          7.86,
          6.71,
          7.52,
          8.85,
          8.62,
          12.69,
          16.63
        ]
      },
      "wind": {
        "calm_frequency": [
          8.19,
          9.82,
          9.05,
          5.66,
          7.27,
          11.12,
          12.93,
          13.46,
          10.29,
          7.63,
          6.43,
          9.19
        ],
        "directions": [
          {
            "frequency": [
              4.83,
              6.41,
              7.91,
              8.31,
              7.83,
              5.64,
              3.72,
              4.37,
              3.5,
              4.13,
              5.22,
              3.59
            ],
            "mean_speed": [
              4.48,
              4.15,
              4.67,
              4.94,
              4.77,
              4.27,
              4.2,
              4.26,
              4.58,
              4.44,
              5.35,
              4.51
            ],
            "skew": [
              0.68,
              0.74,
              0.7,
              0.64,
              0.49,
              0.4,
              0.63,
              0.66,
              0.64,
              0.77,
              0.51,
              0.74
            ],
            "standard_deviation_speed": [
              1.94,
              1.66,
              2.06,
              2.13,
              1.99,
              1.71,
              1.62,
              1.89,
              1.86,
              2.11,
              2.27,
              2.06
            ]
          },
          {
            "frequency": [
              2.24,
              3.12,
              4.26,
              5.56,
              5.87,
              3.16,
              1.79,
              2.61,
              2.07,
              1.98,
              2.76,
              2.23
            ],
            "mean_speed": [
              4.3,
              4.05,
              4.5,
              4.83,
              4.65,
              4.29,
              3.63,
              3.97,
              4.44,
              4.64,
              5.04,
              4.59
            ],
            "skew": [
              0.59,
              0.86,
              0.85,
              0.43,
              0.45,
              0.59,
              0.62,
              0.81,
              0.53,
              0.64,
              0.41,
              0.84
            ],
            "standard_deviation_speed": [
              1.99,
              1.8,
              2.07,
              2.01,
              1.78,
              1.62,
              1.15,
              1.66,
              1.77,
              2.08,
              2.15,
              2.02
            ]
          },
          {
            "frequency": [
              3.62,
              5.6,
              6.5,
              6.88,
              7.79,
              5.82,
              4.09,
              4.57,
              4.13,
              3.67,
              4.31,
              4.83
            ],
            "mean_speed": [
              3.69,
              4.01,
              4.45,
              4.5,
              4.25,
              3.86,
              3.43,
              3.36,
              4.1,
              3.95,
              4.61,
              4.58
            ],
            "skew": [
              1.0,
              1.23,
              1.04,
              0.77,
              0.67,
              1.34,
              0.72,
              1.06,
              0.89,
              1.03,
              0.47,
              0.9
            ],
            "standard_deviation_speed": [
              1.66,
              1.87,
              2.4,
              2.06,
              1.73,
              1.65,
              1.34,
              1.43,
              1.84,
              1.86,
              2.12,
              2.26
            ]
          },
          {
            "frequency": [
              2.65,
              2.7,
              3.99,
              4.5,
              4.76,
              2.94,
              2.02,
              2.41,
              2.54,
              2.05,
              2.22,
              3.09
            ],
            "mean_speed": [
              3.98,
              4.38,
              4.69,
              4.88,
              4.82,
              4.16,
              3.86,
              3.89,
              3.86,
              4.21,
              4.66,
              4.77
            ],
            "skew": [
              0.77,
              0.93,
              0.9,
              0.66,
              0.67,
              0.76,
              0.54,
              0.82,
              0.69,
              0.73,
              0.75,
              0.59
            ],
            "standard_deviation_speed": [
              1.49,
              1.74,
              2.18,
              2.08,
              1.98,
              1.72,
              1.38,
              1.71,
              1.55,
              1.74,
              2.22,
              1.9
            ]
          },
          {
            "frequency": [
              4.43,
              4.04,
              4.8,
              6.46,
              6.85,
              4.66,
              3.92,
              4.01,
              4.33,
              4.74,
              3.61,
              4.5
            ],
            "mean_speed": [
              4.01,
              4.0,
              4.09,
              5.07,
              4.72,
              4.01,
              3.72,
              3.61,
              4.21,
              4.07,
              4.46,
              4.25
            ],
            "skew": [
              0.6,
              0.84,
              0.67,
              0.67,
              0.73,
              0.95,
              0.78,
              0.88,
              0.95,
              0.61,
              0.76,
              0.68
            ],
            "standard_deviation_speed": [
              1.57,
              1.49,
              1.63,
              2.23,